{"apiVersion":"bugate.io/v2","applicability":{"current_task":true,"limitations":["Local managed process observation; not tamper-proof against a same-permission filesystem owner.","A framework result does not prove the correctness of its business oracle."],"run_id":"dsh-636bf020321f0496c6fa711843404a02"},"description":"Managed execution capture","digest":"sha256:98dff3065da7f583defec07309a48c6b5692ea553b8b9159dc3906075107f762","evidence_type":"test_execution","execution":{"activity_id":null,"agent_id":"installed-runtime","argv":["/private/var/folders/f2/78sk3lk55k32h_0mjpjbpd6h0000gn/T/bugate-release-062b03f-nckpukan/clean-install/bootstrap/bin/python","tests/runner.py","logs/installed.xml","normal"],"call_id":"installed-runtime:workflow-29","cases":[{"id":"C1","outcome":"passed","selector":"fixture.test_positive"},{"id":"C2","outcome":"passed","selector":"fixture.test_negative"}],"collector":"bugate.execution/v1","cwd":"/private/var/folders/f2/78sk3lk55k32h_0mjpjbpd6h0000gn/T/bugate-installed-dsh-LPCM8E/generated-project/test-task/same-task","environment_id":"local-fixture","exit_code":0,"finished_at":"2026-10-29T08:32:15.014824+00:00","implementation_digests":{"tests/runner.py":"sha256:5cec9d318e640e8dd96814a3dd0e24374812e77a9d9505d7d681d218bc7a30d8"},"input_manifest":{"@evaluator":"sha256:683e55243d84e47fca1323fa6041c9f948bf114a5556173d9ebf7fa47800fb6e","@profile":"sha256:03c89e6c060bd9ab2d483b10c44d5c4ba0d410c4a6a84fed651ad1d306ba7731","@protocol":"sha256:be1bcf919c65ca07efdc6f0461416390b19c3287d8cb0427165baf62ef3ed444","@source/SRC1":"sha256:273d8bb934d83d46c6f2df4233f6dda130de7e522bffa88764f451397154b68e","artifacts/brief.json":"sha256:072512f4ef96629479a00c514905811280051051babc86a52bc2b53b226bf9dd","artifacts/inventory.json":"sha256:02faebaf388289b6cc51410a915f66bcbd33230388227e988ad3676ae081405d","artifacts/review.json":"sha256:6e850b3a2da4a816402a42809eeb5f15eaf69915195e358c41a74523fe27378d","artifacts/testability.json":"sha256:ab96fd09a507182ecc9e6051eb902cfba5495b6b59fc97fa0e5fe1a51ac36b7f","profile.json":"sha256:9befb36df52ee7b530a785874bf1b5198ac41b9b66cfe8389affc2b08d19794f","scope/active.json":"sha256:ece9347d4effb7ee2330355f40dd09bcd47a8818745028bf60776b7e4471d986","task.json":"sha256:a6d82c39baf837a8b3818b797089281b7419eddafca765c5228580e393906691","tests/runner.py":"sha256:5cec9d318e640e8dd96814a3dd0e24374812e77a9d9505d7d681d218bc7a30d8"},"input_snapshot":"sha256:abe28b52e345585996570ea3590b88ca3b93727dc8583a2268afa87bc2401a49","parent_call_id":null,"plan_ref":{"digest":"sha256:89a9908338eb90425c42b280aad8fc099e4837bcf682ab855c9829d4e8476bc3","id":"inventory"},"report":{"digest":"sha256:abd6af64a62b04a8e5da0d0c400637ec177009fb633f40296f4eecbccfaa0d5a","path":"logs/installed.xml"},"requested_case_ids":["C1","C2"],"root_call_id":"workflow-29","run_id":"dsh-636bf020321f0496c6fa711843404a02","scope_ref":{"digest":"sha256:9717b7810ea98fdc5f5bbf7e0f38e6e715ee5c7f981fc9e835e2a8af8c82cd88","id":"acceptance","revision":1},"session_id":"installed-runtime","started_at":"2026-10-29T08:32:14.994117+00:00","statistics":{"errors":0,"failed":0,"passed":2,"skipped":0,"tests":2,"xfail":0},"status":"passed","stderr":{"digest":"sha256:e3b0c44298fc1c149afbf4c8996fb92427ae41e4649b934ca495991b7852b855","path":"logs/dsh-636bf020321f0496c6fa711843404a02.stderr.log"},"stdout":{"digest":"sha256:7ad54db3b20bd85332078110322f37ae718690d50df72f55540febb6f3406537","path":"logs/dsh-636bf020321f0496c6fa711843404a02.stdout.log"}},"id":"run-dsh-636bf020321f0496c6fa711843404a02","kind":"Evidence","references":[{"digest":"sha256:7ad54db3b20bd85332078110322f37ae718690d50df72f55540febb6f3406537","path":"logs/dsh-636bf020321f0496c6fa711843404a02.stdout.log"},{"digest":"sha256:e3b0c44298fc1c149afbf4c8996fb92427ae41e4649b934ca495991b7852b855","path":"logs/dsh-636bf020321f0496c6fa711843404a02.stderr.log"},{"digest":"sha256:abd6af64a62b04a8e5da0d0c400637ec177009fb633f40296f4eecbccfaa0d5a","path":"logs/installed.xml"}],"source_type":"host_observed","task_id":"same-task","workspace_id":"sha256:cdfdb32e721f3faffef5ba403eebe28f0a19a1fb81d2b00dd530e8962c65c9e2"}
