{"apiVersion":"bugate.io/v2","applicability":{"current_task":true,"limitations":["Local managed process observation; not tamper-proof against a same-permission filesystem owner.","A framework result does not prove the correctness of its business oracle."],"run_id":"dsh-fcb75012e7e95cccfb34224babfe839a"},"description":"Managed execution capture","digest":"sha256:e2d71fd070572746e54517dc7b0b88475ac8e499f00a11454ff8bbd388e373c2","evidence_type":"test_execution","execution":{"activity_id":null,"agent_id":"scope-false","argv":["/Users/zhangliangchen/PycharmProjects/BUGate/.venv/bin/python","tests/runner.py","logs/scope.xml","normal"],"call_id":"scope-false:workflow-29","cases":[{"id":"C1","outcome":"passed","selector":"fixture.test_positive"},{"id":"C2","outcome":"passed","selector":"fixture.test_negative"}],"collector":"bugate.execution/v1","cwd":"/private/var/folders/f2/78sk3lk55k32h_0mjpjbpd6h0000gn/T/bugate-dsh-task-sro6RJ/scope-project/test-task/same-task","environment_id":"local-fixture","exit_code":0,"finished_at":"2026-10-29T07:40:12.029956+00:00","implementation_digests":{"tests/runner.py":"sha256:5cec9d318e640e8dd96814a3dd0e24374812e77a9d9505d7d681d218bc7a30d8"},"input_manifest":{"@evaluator":"sha256:ae21a25662b21227576c7d7ea355baa92706755682305b42a6b2a0eed91e8c11","@profile":"sha256:03c89e6c060bd9ab2d483b10c44d5c4ba0d410c4a6a84fed651ad1d306ba7731","@protocol":"sha256:3b5f0cb8bb6121e51f1ab752a29de935ca66543e1d2914ba5eb2749bad5bd2b7","@source/SRC1":"sha256:273d8bb934d83d46c6f2df4233f6dda130de7e522bffa88764f451397154b68e","artifacts/brief.json":"sha256:072512f4ef96629479a00c514905811280051051babc86a52bc2b53b226bf9dd","artifacts/inventory.json":"sha256:1fd21c977b7e5282d97dbba44ca92b0aa2219247a7ea9d35c11174ebf2c19681","artifacts/review.json":"sha256:721970ccf3a03375e3bc6c7b1f59bab4dd7ae43e5a8dfa7bc97ef7977c04759b","artifacts/testability.json":"sha256:ab96fd09a507182ecc9e6051eb902cfba5495b6b59fc97fa0e5fe1a51ac36b7f","profile.json":"sha256:9befb36df52ee7b530a785874bf1b5198ac41b9b66cfe8389affc2b08d19794f","scope/active.json":"sha256:9b921b44f030cbfb999e86f32f613a282f47c80b1678535c34e79b1619100ddb","task.json":"sha256:1768ba0405efe5bb4bccb1f2acd4817e2476abbcb114fa39490780e18afab8e5","tests/runner.py":"sha256:5cec9d318e640e8dd96814a3dd0e24374812e77a9d9505d7d681d218bc7a30d8"},"input_snapshot":"sha256:bdc3409d4ba9b21b1862109fc5c105d5b5ec3270522b06054359d96785028c6f","parent_call_id":null,"plan_ref":{"digest":"sha256:f259ed2e6938c0ad01a5e1e0c80f4d9fd6bcb68dfccf6f1f87d298f8be18e77f","id":"inventory"},"report":{"digest":"sha256:abd6af64a62b04a8e5da0d0c400637ec177009fb633f40296f4eecbccfaa0d5a","path":"logs/scope.xml"},"requested_case_ids":["C1","C2"],"root_call_id":"workflow-29","run_id":"dsh-fcb75012e7e95cccfb34224babfe839a","scope_ref":{"digest":"sha256:311ae53e1401d0469abd86ee8b2a572c968b3dd8e6ef99ebef3172b15f119df0","id":"acceptance","revision":1},"session_id":"scope-false","started_at":"2026-10-29T07:40:12.008982+00:00","statistics":{"errors":0,"failed":0,"passed":2,"skipped":0,"tests":2,"xfail":0},"status":"passed","stderr":{"digest":"sha256:e3b0c44298fc1c149afbf4c8996fb92427ae41e4649b934ca495991b7852b855","path":"logs/dsh-fcb75012e7e95cccfb34224babfe839a.stderr.log"},"stdout":{"digest":"sha256:7ad54db3b20bd85332078110322f37ae718690d50df72f55540febb6f3406537","path":"logs/dsh-fcb75012e7e95cccfb34224babfe839a.stdout.log"}},"id":"run-dsh-fcb75012e7e95cccfb34224babfe839a","kind":"Evidence","references":[{"digest":"sha256:7ad54db3b20bd85332078110322f37ae718690d50df72f55540febb6f3406537","path":"logs/dsh-fcb75012e7e95cccfb34224babfe839a.stdout.log"},{"digest":"sha256:e3b0c44298fc1c149afbf4c8996fb92427ae41e4649b934ca495991b7852b855","path":"logs/dsh-fcb75012e7e95cccfb34224babfe839a.stderr.log"},{"digest":"sha256:abd6af64a62b04a8e5da0d0c400637ec177009fb633f40296f4eecbccfaa0d5a","path":"logs/scope.xml"}],"source_type":"host_observed","task_id":"same-task","workspace_id":"sha256:f5a07389ea291400fc6c78a0f58df92724dd509870d419c3aca5db5596d6a4b6"}
