{"apiVersion":"bugate.io/v2","applicability":{"current_task":true,"limitations":["Local managed process observation; not tamper-proof against a same-permission filesystem owner.","A framework result does not prove the correctness of its business oracle."],"run_id":"dsh-636bf020321f0496c6fa711843404a02"},"description":"Managed execution capture","digest":"sha256:2d61df0ced6e2147fa06d1be3bd10357e94d458eb71ae84496109973f09fdcd2","evidence_type":"test_execution","execution":{"activity_id":null,"agent_id":"installed-runtime","argv":["/private/var/folders/f2/78sk3lk55k32h_0mjpjbpd6h0000gn/T/bugate-scope-c9d2b82-cu5t1_z2/clean-install/bootstrap/bin/python","tests/runner.py","logs/installed.xml","normal"],"call_id":"installed-runtime:workflow-29","cases":[{"id":"C1","outcome":"passed","selector":"fixture.test_positive"},{"id":"C2","outcome":"passed","selector":"fixture.test_negative"}],"collector":"bugate.execution/v1","cwd":"/private/var/folders/f2/78sk3lk55k32h_0mjpjbpd6h0000gn/T/bugate-installed-dsh-MB4gC0/generated-project/test-task/same-task","environment_id":"local-fixture","exit_code":0,"finished_at":"2026-10-29T07:46:39.297380+00:00","implementation_digests":{"tests/runner.py":"sha256:5cec9d318e640e8dd96814a3dd0e24374812e77a9d9505d7d681d218bc7a30d8"},"input_manifest":{"@evaluator":"sha256:ae21a25662b21227576c7d7ea355baa92706755682305b42a6b2a0eed91e8c11","@profile":"sha256:03c89e6c060bd9ab2d483b10c44d5c4ba0d410c4a6a84fed651ad1d306ba7731","@protocol":"sha256:3b5f0cb8bb6121e51f1ab752a29de935ca66543e1d2914ba5eb2749bad5bd2b7","@source/SRC1":"sha256:273d8bb934d83d46c6f2df4233f6dda130de7e522bffa88764f451397154b68e","artifacts/brief.json":"sha256:072512f4ef96629479a00c514905811280051051babc86a52bc2b53b226bf9dd","artifacts/inventory.json":"sha256:433e8077e4eed5ed06684a30e3cf86ee5a967b5c337f716d5886b19bbbbec7bf","artifacts/review.json":"sha256:3c88294675cdda181d8c43a65ae870251ccb5d03bde102ff9e1f2fddda4f6bc2","artifacts/testability.json":"sha256:ab96fd09a507182ecc9e6051eb902cfba5495b6b59fc97fa0e5fe1a51ac36b7f","profile.json":"sha256:9befb36df52ee7b530a785874bf1b5198ac41b9b66cfe8389affc2b08d19794f","scope/active.json":"sha256:f7d360333d2ae0eb0fcd876794c1ff2a7d50e7b645d96ddc110d5254ae929176","task.json":"sha256:b5e3a31ebf66a40044c3f1fd46ca74f1000af645d724028d56736f162956a3ab","tests/runner.py":"sha256:5cec9d318e640e8dd96814a3dd0e24374812e77a9d9505d7d681d218bc7a30d8"},"input_snapshot":"sha256:e7a784903865968b904af3f692bb8a8675c34fa85fd77f229e0e35090dd6e376","parent_call_id":null,"plan_ref":{"digest":"sha256:4d277f62a8e75afb5d10b092eea31d551b11d43043a4806fcc86dec8f54c0a8c","id":"inventory"},"report":{"digest":"sha256:abd6af64a62b04a8e5da0d0c400637ec177009fb633f40296f4eecbccfaa0d5a","path":"logs/installed.xml"},"requested_case_ids":["C1","C2"],"root_call_id":"workflow-29","run_id":"dsh-636bf020321f0496c6fa711843404a02","scope_ref":{"digest":"sha256:706120e6595e1d6c455a088c0c81b6a228a8324ee7896c9d138f70bc09aa5eb4","id":"acceptance","revision":1},"session_id":"installed-runtime","started_at":"2026-10-29T07:46:39.275560+00:00","statistics":{"errors":0,"failed":0,"passed":2,"skipped":0,"tests":2,"xfail":0},"status":"passed","stderr":{"digest":"sha256:e3b0c44298fc1c149afbf4c8996fb92427ae41e4649b934ca495991b7852b855","path":"logs/dsh-636bf020321f0496c6fa711843404a02.stderr.log"},"stdout":{"digest":"sha256:7ad54db3b20bd85332078110322f37ae718690d50df72f55540febb6f3406537","path":"logs/dsh-636bf020321f0496c6fa711843404a02.stdout.log"}},"id":"run-dsh-636bf020321f0496c6fa711843404a02","kind":"Evidence","references":[{"digest":"sha256:7ad54db3b20bd85332078110322f37ae718690d50df72f55540febb6f3406537","path":"logs/dsh-636bf020321f0496c6fa711843404a02.stdout.log"},{"digest":"sha256:e3b0c44298fc1c149afbf4c8996fb92427ae41e4649b934ca495991b7852b855","path":"logs/dsh-636bf020321f0496c6fa711843404a02.stderr.log"},{"digest":"sha256:abd6af64a62b04a8e5da0d0c400637ec177009fb633f40296f4eecbccfaa0d5a","path":"logs/installed.xml"}],"source_type":"host_observed","task_id":"same-task","workspace_id":"sha256:b62dbe56b4691a69b45268f2c10e82cfe97373b23eadb392eef774d7e0c16000"}
