{"apiVersion":"bugate.io/v2","applicability":{"current_task":true,"limitations":["Local managed process observation; not tamper-proof against a same-permission filesystem owner.","A framework result does not prove the correctness of its business oracle."],"run_id":"dsh-fcb75012e7e95cccfb34224babfe839a"},"description":"Managed execution capture","digest":"sha256:f7260ae21da3aa7a95628a0bc1706e32a4440636d50c76b1680686dcd2ce70b2","evidence_type":"test_execution","execution":{"activity_id":null,"agent_id":"scope-false","argv":["/Users/zhangliangchen/PycharmProjects/BUGate/.venv/bin/python","tests/runner.py","logs/scope.xml","normal"],"call_id":"scope-false:workflow-29","cases":[{"id":"C1","outcome":"passed","selector":"fixture.test_positive"},{"id":"C2","outcome":"passed","selector":"fixture.test_negative"}],"collector":"bugate.execution/v1","cwd":"/private/var/folders/f2/78sk3lk55k32h_0mjpjbpd6h0000gn/T/bugate-dsh-task-axrIvJ/scope-project/test-task/same-task","environment_id":"local-fixture","exit_code":0,"finished_at":"2026-10-29T07:33:37.008499+00:00","implementation_digests":{"tests/runner.py":"sha256:5cec9d318e640e8dd96814a3dd0e24374812e77a9d9505d7d681d218bc7a30d8"},"input_manifest":{"@evaluator":"sha256:1cf622eb2143b590196b6ce8954f969ce50549caa97e7816fb1058135fc93f8f","@profile":"sha256:03c89e6c060bd9ab2d483b10c44d5c4ba0d410c4a6a84fed651ad1d306ba7731","@protocol":"sha256:3b5f0cb8bb6121e51f1ab752a29de935ca66543e1d2914ba5eb2749bad5bd2b7","@source/SRC1":"sha256:273d8bb934d83d46c6f2df4233f6dda130de7e522bffa88764f451397154b68e","artifacts/brief.json":"sha256:072512f4ef96629479a00c514905811280051051babc86a52bc2b53b226bf9dd","artifacts/inventory.json":"sha256:15d7c9611589e800da7f1208a0136bb027389a4bdad5a908c9e22a9e0491084f","artifacts/review.json":"sha256:25314fc5747c5450c68623950cb994cc79ba35efe0e41021129203151798ce7e","artifacts/testability.json":"sha256:ab96fd09a507182ecc9e6051eb902cfba5495b6b59fc97fa0e5fe1a51ac36b7f","profile.json":"sha256:9befb36df52ee7b530a785874bf1b5198ac41b9b66cfe8389affc2b08d19794f","scope/active.json":"sha256:475577e2e38bb02472c5b2f7eb7d46bedf34b088976c7582eba2280f8873030c","task.json":"sha256:58dfcda4141888354b5e98fcd5571863bc3377aff43ebce921864c036bc1e3b1","tests/runner.py":"sha256:5cec9d318e640e8dd96814a3dd0e24374812e77a9d9505d7d681d218bc7a30d8"},"input_snapshot":"sha256:9ffd416a64d8a3bce427ebde5c32f66fb845fee7803df63117f054ece122d610","parent_call_id":null,"plan_ref":{"digest":"sha256:30684636de7d1d545bdab1fc574b40f490fd14e1a717e4ba0452f60c0e47b6ca","id":"inventory"},"report":{"digest":"sha256:abd6af64a62b04a8e5da0d0c400637ec177009fb633f40296f4eecbccfaa0d5a","path":"logs/scope.xml"},"requested_case_ids":["C1","C2"],"root_call_id":"workflow-29","run_id":"dsh-fcb75012e7e95cccfb34224babfe839a","scope_ref":{"digest":"sha256:3327ddaa2ada183e8c5eb5a559b5d655a21990e2e232d01395f9fa2ba34414c0","id":"acceptance","revision":1},"session_id":"scope-false","started_at":"2026-10-29T07:33:36.987404+00:00","statistics":{"errors":0,"failed":0,"passed":2,"skipped":0,"tests":2,"xfail":0},"status":"passed","stderr":{"digest":"sha256:e3b0c44298fc1c149afbf4c8996fb92427ae41e4649b934ca495991b7852b855","path":"logs/dsh-fcb75012e7e95cccfb34224babfe839a.stderr.log"},"stdout":{"digest":"sha256:7ad54db3b20bd85332078110322f37ae718690d50df72f55540febb6f3406537","path":"logs/dsh-fcb75012e7e95cccfb34224babfe839a.stdout.log"}},"id":"run-dsh-fcb75012e7e95cccfb34224babfe839a","kind":"Evidence","references":[{"digest":"sha256:7ad54db3b20bd85332078110322f37ae718690d50df72f55540febb6f3406537","path":"logs/dsh-fcb75012e7e95cccfb34224babfe839a.stdout.log"},{"digest":"sha256:e3b0c44298fc1c149afbf4c8996fb92427ae41e4649b934ca495991b7852b855","path":"logs/dsh-fcb75012e7e95cccfb34224babfe839a.stderr.log"},{"digest":"sha256:abd6af64a62b04a8e5da0d0c400637ec177009fb633f40296f4eecbccfaa0d5a","path":"logs/scope.xml"}],"source_type":"host_observed","task_id":"same-task","workspace_id":"sha256:144734d933fb9d031f58be85e71995b6bbd9917668e582e753c2963ce10245ca"}
